{
  "schema_version": "1.0",
  "request_id": "REQ-EXAMPLE",
  "mode": "REVIEW",
  "source": {
    "locator": "user-provided-request",
    "sha256": null,
    "captured_at": "2026-10-11T00:00:00+00:00",
    "available_scope": "Illustrative template only; replace with the actual captured request."
  },
  "original_text": "Review the proposed change without editing the repository.",
  "goal": "Identify evidence-backed gaps and corrections.",
  "scope": [
    "Read-only review of the named change"
  ],
  "exclusions": [
    "No source modification",
    "No publication"
  ],
  "authority_ref": null,
  "acceptance_criteria": [
    "Findings distinguish facts, inference and unverified claims."
  ],
  "items": [],
  "clarifications": []
}
